{
  "run_id": "06fca1cd-d46f-4e96-b993-33687e3fe59d",
  "timestamp_utc": "2026-02-12T05:08:47Z",
  "pipeline": {
    "name": "chainsaw-evtx",
    "version": "0.1.0"
  },
  "source_findings": {
    "path": "outputs/jsonl/chainsaw_evtx/06fca1cd-d46f-4e96-b993-33687e3fe59d/findings.json",
    "sha256": "409739982339d135a78b0f85797885c1897c1ecdf179caf8e5a44a50af2c95d3",
    "size": 1306866,
    "count": 339
  },
  "time_bounds": {
    "min_first_seen": "2026-01-14T10:49:44.557632+00:00",
    "max_last_seen": "2026-01-14T12:57:04.021180+00:00"
  },
  "counts": {
    "total_findings": 339,
    "by_severity": {
      "critical": 1,
      "high": 2,
      "informational": 336
    },
    "by_rule_id": [
      {
        "rule_id": "RAWREF:chainsaw.evtx.jsonl:line:1",
        "rule_title": "User Profile Disk - Registry file loaded",
        "count": 1
      },
      {
        "rule_id": "RAWREF:chainsaw.evtx.jsonl:line:10",
        "rule_title": "Network Logon",
        "count": 1
      },
      {
        "rule_id": "RAWREF:chainsaw.evtx.jsonl:line:100",
        "rule_title": "Network Logon",
        "count": 1
      },
      {
        "rule_id": "RAWREF:chainsaw.evtx.jsonl:line:101",
        "rule_title": "Network Logon",
        "count": 1
      },
      {
        "rule_id": "RAWREF:chainsaw.evtx.jsonl:line:102",
        "rule_title": "Network Logon",
        "count": 1
      },
      {
        "rule_id": "RAWREF:chainsaw.evtx.jsonl:line:103",
        "rule_title": "Network Logon",
        "count": 1
      },
      {
        "rule_id": "RAWREF:chainsaw.evtx.jsonl:line:104",
        "rule_title": "Network Logon",
        "count": 1
      },
      {
        "rule_id": "RAWREF:chainsaw.evtx.jsonl:line:105",
        "rule_title": "Network Logon",
        "count": 1
      },
      {
        "rule_id": "RAWREF:chainsaw.evtx.jsonl:line:106",
        "rule_title": "Network Logon",
        "count": 1
      },
      {
        "rule_id": "RAWREF:chainsaw.evtx.jsonl:line:107",
        "rule_title": "Network Logon",
        "count": 1
      },
      {
        "rule_id": "RAWREF:chainsaw.evtx.jsonl:line:108",
        "rule_title": "Network Logon",
        "count": 1
      },
      {
        "rule_id": "RAWREF:chainsaw.evtx.jsonl:line:109",
        "rule_title": "Network Logon",
        "count": 1
      },
      {
        "rule_id": "RAWREF:chainsaw.evtx.jsonl:line:11",
        "rule_title": "Network Logon",
        "count": 1
      },
      {
        "rule_id": "RAWREF:chainsaw.evtx.jsonl:line:110",
        "rule_title": "Network Logon",
        "count": 1
      },
      {
        "rule_id": "RAWREF:chainsaw.evtx.jsonl:line:111",
        "rule_title": "Network Logon",
        "count": 1
      },
      {
        "rule_id": "RAWREF:chainsaw.evtx.jsonl:line:112",
        "rule_title": "Network Logon",
        "count": 1
      },
      {
        "rule_id": "RAWREF:chainsaw.evtx.jsonl:line:113",
        "rule_title": "Network Logon",
        "count": 1
      },
      {
        "rule_id": "RAWREF:chainsaw.evtx.jsonl:line:114",
        "rule_title": "Network Logon",
        "count": 1
      },
      {
        "rule_id": "RAWREF:chainsaw.evtx.jsonl:line:115",
        "rule_title": "Network Logon",
        "count": 1
      },
      {
        "rule_id": "RAWREF:chainsaw.evtx.jsonl:line:116",
        "rule_title": "Network Logon",
        "count": 1
      },
      {
        "rule_id": "RAWREF:chainsaw.evtx.jsonl:line:117",
        "rule_title": "Network Logon",
        "count": 1
      },
      {
        "rule_id": "RAWREF:chainsaw.evtx.jsonl:line:118",
        "rule_title": "Network Logon",
        "count": 1
      },
      {
        "rule_id": "RAWREF:chainsaw.evtx.jsonl:line:119",
        "rule_title": "Network Logon",
        "count": 1
      },
      {
        "rule_id": "RAWREF:chainsaw.evtx.jsonl:line:12",
        "rule_title": "Network Logon",
        "count": 1
      },
      {
        "rule_id": "RAWREF:chainsaw.evtx.jsonl:line:120",
        "rule_title": "Network Logon",
        "count": 1
      },
      {
        "rule_id": "RAWREF:chainsaw.evtx.jsonl:line:121",
        "rule_title": "Network Logon",
        "count": 1
      },
      {
        "rule_id": "RAWREF:chainsaw.evtx.jsonl:line:122",
        "rule_title": "Network Logon",
        "count": 1
      },
      {
        "rule_id": "RAWREF:chainsaw.evtx.jsonl:line:123",
        "rule_title": "Network Logon",
        "count": 1
      },
      {
        "rule_id": "RAWREF:chainsaw.evtx.jsonl:line:124",
        "rule_title": "Network Logon",
        "count": 1
      },
      {
        "rule_id": "RAWREF:chainsaw.evtx.jsonl:line:125",
        "rule_title": "Network Logon",
        "count": 1
      },
      {
        "rule_id": "RAWREF:chainsaw.evtx.jsonl:line:126",
        "rule_title": "Network Logon",
        "count": 1
      },
      {
        "rule_id": "RAWREF:chainsaw.evtx.jsonl:line:127",
        "rule_title": "Network Logon",
        "count": 1
      },
      {
        "rule_id": "RAWREF:chainsaw.evtx.jsonl:line:128",
        "rule_title": "Network Logon",
        "count": 1
      },
      {
        "rule_id": "RAWREF:chainsaw.evtx.jsonl:line:129",
        "rule_title": "Network Logon",
        "count": 1
      },
      {
        "rule_id": "RAWREF:chainsaw.evtx.jsonl:line:13",
        "rule_title": "Network Logon",
        "count": 1
      },
      {
        "rule_id": "RAWREF:chainsaw.evtx.jsonl:line:130",
        "rule_title": "Network Logon",
        "count": 1
      },
      {
        "rule_id": "RAWREF:chainsaw.evtx.jsonl:line:131",
        "rule_title": "Network Logon",
        "count": 1
      },
      {
        "rule_id": "RAWREF:chainsaw.evtx.jsonl:line:132",
        "rule_title": "Network Logon",
        "count": 1
      },
      {
        "rule_id": "RAWREF:chainsaw.evtx.jsonl:line:133",
        "rule_title": "Network Logon",
        "count": 1
      },
      {
        "rule_id": "RAWREF:chainsaw.evtx.jsonl:line:134",
        "rule_title": "Network Logon",
        "count": 1
      },
      {
        "rule_id": "RAWREF:chainsaw.evtx.jsonl:line:135",
        "rule_title": "Network Logon",
        "count": 1
      },
      {
        "rule_id": "RAWREF:chainsaw.evtx.jsonl:line:136",
        "rule_title": "Network Logon",
        "count": 1
      },
      {
        "rule_id": "RAWREF:chainsaw.evtx.jsonl:line:137",
        "rule_title": "Network Logon",
        "count": 1
      },
      {
        "rule_id": "RAWREF:chainsaw.evtx.jsonl:line:138",
        "rule_title": "Network Logon",
        "count": 1
      },
      {
        "rule_id": "RAWREF:chainsaw.evtx.jsonl:line:139",
        "rule_title": "Network Logon",
        "count": 1
      },
      {
        "rule_id": "RAWREF:chainsaw.evtx.jsonl:line:14",
        "rule_title": "Network Logon",
        "count": 1
      },
      {
        "rule_id": "RAWREF:chainsaw.evtx.jsonl:line:140",
        "rule_title": "Network Logon",
        "count": 1
      },
      {
        "rule_id": "RAWREF:chainsaw.evtx.jsonl:line:141",
        "rule_title": "Network Logon",
        "count": 1
      },
      {
        "rule_id": "RAWREF:chainsaw.evtx.jsonl:line:142",
        "rule_title": "Network Logon",
        "count": 1
      },
      {
        "rule_id": "RAWREF:chainsaw.evtx.jsonl:line:143",
        "rule_title": "Network Logon",
        "count": 1
      },
      {
        "rule_id": "RAWREF:chainsaw.evtx.jsonl:line:144",
        "rule_title": "Network Logon",
        "count": 1
      },
      {
        "rule_id": "RAWREF:chainsaw.evtx.jsonl:line:145",
        "rule_title": "Network Logon",
        "count": 1
      },
      {
        "rule_id": "RAWREF:chainsaw.evtx.jsonl:line:146",
        "rule_title": "Network Logon",
        "count": 1
      },
      {
        "rule_id": "RAWREF:chainsaw.evtx.jsonl:line:147",
        "rule_title": "Network Logon",
        "count": 1
      },
      {
        "rule_id": "RAWREF:chainsaw.evtx.jsonl:line:148",
        "rule_title": "Network Logon",
        "count": 1
      },
      {
        "rule_id": "RAWREF:chainsaw.evtx.jsonl:line:149",
        "rule_title": "Network Logon",
        "count": 1
      },
      {
        "rule_id": "RAWREF:chainsaw.evtx.jsonl:line:15",
        "rule_title": "Network Logon",
        "count": 1
      },
      {
        "rule_id": "RAWREF:chainsaw.evtx.jsonl:line:150",
        "rule_title": "Network Logon",
        "count": 1
      },
      {
        "rule_id": "RAWREF:chainsaw.evtx.jsonl:line:151",
        "rule_title": "Network Logon",
        "count": 1
      },
      {
        "rule_id": "RAWREF:chainsaw.evtx.jsonl:line:152",
        "rule_title": "Network Logon",
        "count": 1
      },
      {
        "rule_id": "RAWREF:chainsaw.evtx.jsonl:line:153",
        "rule_title": "Network Logon",
        "count": 1
      },
      {
        "rule_id": "RAWREF:chainsaw.evtx.jsonl:line:154",
        "rule_title": "Network Logon",
        "count": 1
      },
      {
        "rule_id": "RAWREF:chainsaw.evtx.jsonl:line:155",
        "rule_title": "Network Logon",
        "count": 1
      },
      {
        "rule_id": "RAWREF:chainsaw.evtx.jsonl:line:156",
        "rule_title": "Network Logon",
        "count": 1
      },
      {
        "rule_id": "RAWREF:chainsaw.evtx.jsonl:line:157",
        "rule_title": "Network Logon",
        "count": 1
      },
      {
        "rule_id": "RAWREF:chainsaw.evtx.jsonl:line:158",
        "rule_title": "Network Logon",
        "count": 1
      },
      {
        "rule_id": "RAWREF:chainsaw.evtx.jsonl:line:159",
        "rule_title": "Network Logon",
        "count": 1
      },
      {
        "rule_id": "RAWREF:chainsaw.evtx.jsonl:line:16",
        "rule_title": "Network Logon",
        "count": 1
      },
      {
        "rule_id": "RAWREF:chainsaw.evtx.jsonl:line:160",
        "rule_title": "Network Logon",
        "count": 1
      },
      {
        "rule_id": "RAWREF:chainsaw.evtx.jsonl:line:161",